============================================================
SMART CONTEXT & OUTPUT TESTING
Started: 2026-01-18T11:20:46.972819
============================================================

============================================================
Testing: 
============================================================
  Family: unknown
  Size: unknown
  Testing 4K... FAILED - HTTP 404

  Native context limit: 0 tokens
  Recommended input:    0 tokens

  Testing output limit...
    num_predict=1024... FAILED

============================================================
Testing: hf.co/DavidAU/Qwen3-24B-A4B-Freedom-HQ-Thinking-Abliterated-Heretic-NEOMAX-Imatrix-GGUF:latest
============================================================
  Family: qwen3moe
  Size: 17.9B
  Testing 4K... OK (2063 tokens, 2.0s)
  Testing 8K... OK (4111 tokens, 2.83s)
  Testing 16K... OK (8207 tokens, 3.5s)
  Testing 32K... OK (16399 tokens, 4.66s)
  Testing 64K... OK (32783 tokens, 8.53s)
  Testing 128K... OK (65551 tokens, 36.77s)
  Testing 192K... OK (98319 tokens, 99.88s)

  Native context limit: 98319 tokens
  Recommended input:    88487 tokens

  Testing output limit...
    num_predict=1024... FAILED

============================================================
Testing: 
============================================================
  Family: unknown
  Size: unknown
  Testing 4K... FAILED - HTTP 404

  Native context limit: 0 tokens
  Recommended input:    0 tokens

  Testing output limit...
    num_predict=1024... FAILED

============================================================
Testing: hf.co/DevQuasar/FreedomIntelligence.HuatuoGPT-o1-8B-GGUF:Q4_K_M
============================================================
  Family: llama
  Size: 8.03B
  Testing 4K... OK (2063 tokens, 7.35s)
  Testing 8K... OK (4111 tokens, 1.92s)
  Testing 16K... OK (8207 tokens, 2.34s)
  Testing 32K... OK (16399 tokens, 3.51s)
  Testing 64K... OK (32783 tokens, 6.13s)
  Testing 128K... OK (65551 tokens, 68.69s)
  Testing 192K... OK (98319 tokens, 127.74s)

  Native context limit: 98319 tokens
  Recommended input:    88487 tokens

  Testing output limit...
    num_predict=1024... 1024 tokens (24.0 tok/s)
    num_predict=2048... 2048 tokens (27.7 tok/s)
    num_predict=4096... 2839 tokens (27.2 tok/s)
    num_predict=8192... 8192 tokens (22.4 tok/s)
    num_predict=16384... 2759 tokens (27.2 tok/s)
    Output limit found: 2759

============================================================
Testing: 
============================================================
  Family: unknown
  Size: unknown
  Testing 4K... FAILED - HTTP 404

  Native context limit: 0 tokens
  Recommended input:    0 tokens

  Testing output limit...
    num_predict=1024... FAILED

============================================================
Testing: hf.co/alexwirrell/Meta-Llama-3-8B-Instruct-Jailbroken-Q4_K_M-GGUF:Q4_K_M
============================================================
  Family: llama
  Size: 8.03B
  Testing 4K... OK (2073 tokens, 7.82s)
  Testing 8K... OK (4121 tokens, 2.11s)
  Testing 16K... OK (8192 tokens, 2.39s)
  Testing 32K... NATIVE LIMIT FOUND: 8192 tokens

  Native context limit: 8192 tokens
  Recommended input:    7372 tokens

  Testing output limit...
    num_predict=1024... 273 tokens (83.5 tok/s)
    num_predict=2048... 874 tokens (152.3 tok/s)
    num_predict=4096... 847 tokens (152.3 tok/s)
    Output limit found: 847

============================================================
Testing: 
============================================================
  Family: unknown
  Size: unknown
  Testing 4K... FAILED - HTTP 404

  Native context limit: 0 tokens
  Recommended input:    0 tokens

  Testing output limit...
    num_predict=1024... FAILED

============================================================
Testing: hf.co/mradermacher/Llama-3.1-8B-Instruct-Freedom_v3-GGUF:Q4_K_M
============================================================
  Family: llama
  Size: 8.03B
  Testing 4K... OK (2063 tokens, 2.32s)
  Testing 8K... OK (4111 tokens, 1.95s)
  Testing 16K... OK (8207 tokens, 2.4s)
  Testing 32K... OK (16399 tokens, 3.34s)
  Testing 64K... OK (32783 tokens, 6.47s)
  Testing 128K... OK (65551 tokens, 68.15s)
  Testing 192K... OK (98319 tokens, 126.89s)

  Native context limit: 98319 tokens
  Recommended input:    88487 tokens

  Testing output limit...
    num_predict=1024... 1024 tokens (24.4 tok/s)
    num_predict=2048... 1276 tokens (28.5 tok/s)
    num_predict=4096... 668 tokens (29.1 tok/s)
    Output limit found: 668

============================================================
Testing: 
============================================================
  Family: unknown
  Size: unknown
  Testing 4K... FAILED - HTTP 404

  Native context limit: 0 tokens
  Recommended input:    0 tokens

  Testing output limit...
    num_predict=1024... FAILED

============================================================
Testing: hf.co/mradermacher/Mirai-Nova-Llama3-LocalAI-Unchained-8B-v0.2-GGUF:Q4_K_M
============================================================
  Family: llama
  Size: 8.03B
  Testing 4K... OK (2253 tokens, 7.23s)
  Testing 8K... OK (4301 tokens, 2.01s)
  Testing 16K... OK (8192 tokens, 2.26s)
  Testing 32K... NATIVE LIMIT FOUND: 8192 tokens

  Native context limit: 8192 tokens
  Recommended input:    7372 tokens

  Testing output limit...
    num_predict=1024... 2 tokens (1.3 tok/s)
    num_predict=2048... 2 tokens (16.6 tok/s)
    Output limit found: 2

============================================================
Testing: 
============================================================
  Family: unknown
  Size: unknown
  Testing 4K... FAILED - HTTP 404

  Native context limit: 0 tokens
  Recommended input:    0 tokens

  Testing output limit...
    num_predict=1024... FAILED

============================================================
Testing: hf.co/mradermacher/Mistral-Nemo-Inst-2407-12B-Thinking-Uncensored-HERETIC-HI-Claude-Opus-i1-GGUF:Q4_K_M
============================================================
  Family: llama
  Size: 12.2B
  Testing 4K... OK (2119 tokens, 2.73s)
  Testing 8K... OK (4167 tokens, 2.5s)
  Testing 16K... OK (8263 tokens, 3.17s)
  Testing 32K... OK (16455 tokens, 4.92s)
  Testing 64K... OK (32839 tokens, 16.1s)
  Testing 128K... OK (65607 tokens, 96.54s)
  Testing 192K... OK (98375 tokens, 217.6s)

  Native context limit: 98375 tokens
  Recommended input:    88537 tokens

  Testing output limit...
    num_predict=1024... 1024 tokens (13.0 tok/s)
    num_predict=2048... 2048 tokens (13.9 tok/s)
    num_predict=4096... 4096 tokens (13.0 tok/s)
    num_predict=8192... ERROR: HTTPConnectionPool(host='localhost', port=11434): Read timed out. (read timeout=600)

============================================================
Testing: 
============================================================
  Family: unknown
  Size: unknown
  Testing 4K... FAILED - HTTP 404

  Native context limit: 0 tokens
  Recommended input:    0 tokens

  Testing output limit...
    num_predict=1024... FAILED

============================================================
Testing: hf.co/mradermacher/Qwen2.5-7B-Instruct-Jailbroken-GGUF:Q4_K_M
============================================================
  Family: qwen2
  Size: 7.62B
  Testing 4K... OK (2061 tokens, 2.16s)
  Testing 8K... OK (4109 tokens, 2.12s)
  Testing 16K... OK (8205 tokens, 7.55s)
  Testing 32K... OK (16397 tokens, 3.23s)
  Testing 64K... OK (32768 tokens, 5.85s)
  Testing 128K... NATIVE LIMIT FOUND: 32768 tokens

  Native context limit: 32768 tokens
  Recommended input:    29491 tokens

  Testing output limit...
    num_predict=1024... 1024 tokens (130.1 tok/s)
    num_predict=2048... 1362 tokens (160.7 tok/s)
    num_predict=4096... 1225 tokens (161.3 tok/s)
    Output limit found: 1225

============================================================
Testing: 
============================================================
  Family: unknown
  Size: unknown
  Testing 4K... FAILED - HTTP 404

  Native context limit: 0 tokens
  Recommended input:    0 tokens

  Testing output limit...
    num_predict=1024... FAILED

============================================================
Testing: hf.co/mradermacher/Qwen3-8B-Jailbroken-i1-GGUF:Q4_K_M
============================================================
  Family: qwen3
  Size: 8.19B
  Testing 4K... OK (2063 tokens, 1.54s)
  Testing 8K... OK (4111 tokens, 2.04s)
  Testing 16K... OK (8207 tokens, 2.23s)
  Testing 32K... OK (16399 tokens, 3.63s)
  Testing 64K... OK (32783 tokens, 6.44s)
  Testing 128K... NATIVE LIMIT FOUND: 40960 tokens

  Native context limit: 40960 tokens
  Recommended input:    36864 tokens

  Testing output limit...
    num_predict=1024... 1024 tokens (120.6 tok/s)
    num_predict=2048... 2048 tokens (147.9 tok/s)
    num_predict=4096... 2785 tokens (146.9 tok/s)
    num_predict=8192... 3814 tokens (145.4 tok/s)
    num_predict=16384... 5119 tokens (143.3 tok/s)

============================================================
Testing: 
============================================================
  Family: unknown
  Size: unknown
  Testing 4K... FAILED - HTTP 404

  Native context limit: 0 tokens
  Recommended input:    0 tokens

  Testing output limit...
    num_predict=1024... FAILED

============================================================
Testing: hf.co/mxf-pth/Qwen3-8B-Jailbroken-Q5_K_M-GGUF:Q5_K_M
============================================================
  Family: qwen3
  Size: 8.19B
  Testing 4K... OK (2063 tokens, 1.86s)
  Testing 8K... OK (4111 tokens, 1.75s)
  Testing 16K... OK (8207 tokens, 2.49s)
  Testing 32K... OK (16399 tokens, 4.05s)
  Testing 64K... OK (32783 tokens, 6.63s)
  Testing 128K... NATIVE LIMIT FOUND: 40960 tokens

  Native context limit: 40960 tokens
  Recommended input:    36864 tokens

  Testing output limit...
    num_predict=1024... 1024 tokens (110.7 tok/s)
    num_predict=2048... 2048 tokens (132.7 tok/s)
    num_predict=4096... 4024 tokens (130.2 tok/s)
    num_predict=8192... 2989 tokens (131.5 tok/s)
    Output limit found: 2989

============================================================
Testing: 
============================================================
  Family: unknown
  Size: unknown
  Testing 4K... FAILED - HTTP 404

  Native context limit: 0 tokens
  Recommended input:    0 tokens

  Testing output limit...
    num_predict=1024... FAILED

============================================================
Testing: llama3.1:8b
============================================================
  Family: llama
  Size: 8.0B
  Testing 4K... OK (2063 tokens, 2.85s)
  Testing 8K... OK (4111 tokens, 1.87s)
  Testing 16K... OK (8207 tokens, 2.7s)
  Testing 32K... OK (16399 tokens, 3.59s)
  Testing 64K... OK (32783 tokens, 6.2s)
  Testing 128K... OK (65551 tokens, 68.2s)
  Testing 192K... OK (98319 tokens, 127.49s)

  Native context limit: 98319 tokens
  Recommended input:    88487 tokens

  Testing output limit...
    num_predict=1024... 1024 tokens (24.0 tok/s)
    num_predict=2048... 625 tokens (29.0 tok/s)
    Output limit found: 625

============================================================
Testing: 
============================================================
  Family: unknown
  Size: unknown
  Testing 4K... FAILED - HTTP 404

  Native context limit: 0 tokens
  Recommended input:    0 tokens

  Testing output limit...
    num_predict=1024... FAILED

============================================================
Testing: llama3.2:latest
============================================================
  Family: llama
  Size: 3.2B
  Testing 4K... OK (2078 tokens, 1.29s)
  Testing 8K... OK (4126 tokens, 1.54s)
  Testing 16K... OK (8222 tokens, 1.75s)
  Testing 32K... OK (16414 tokens, 7.45s)
  Testing 64K... OK (32798 tokens, 4.12s)
  Testing 128K... OK (65566 tokens, 33.93s)
  Testing 192K... OK (98334 tokens, 67.55s)

  Native context limit: 98334 tokens
  Recommended input:    88500 tokens

  Testing output limit...
    num_predict=1024... 797 tokens (90.4 tok/s)
    num_predict=2048... 2048 tokens (274.9 tok/s)
    num_predict=4096... 2900 tokens (268.8 tok/s)
    num_predict=8192... 927 tokens (269.8 tok/s)
    Output limit found: 927

============================================================
Testing: 
============================================================
  Family: unknown
  Size: unknown
  Testing 4K... FAILED - HTTP 404

  Native context limit: 0 tokens
  Recommended input:    0 tokens

  Testing output limit...
    num_predict=1024... FAILED

============================================================
Testing: mistral:latest
============================================================
  Family: llama
  Size: 7.2B
  Testing 4K... OK (2057 tokens, 1.65s)
  Testing 8K... OK (4105 tokens, 2.16s)
  Testing 16K... OK (8201 tokens, 2.24s)
  Testing 32K... OK (16393 tokens, 3.28s)
  Testing 64K... OK (32768 tokens, 6.01s)
  Testing 128K... NATIVE LIMIT FOUND: 32768 tokens

  Native context limit: 32768 tokens
  Recommended input:    29491 tokens

  Testing output limit...
    num_predict=1024... 1024 tokens (142.4 tok/s)
    num_predict=2048... 887 tokens (174.3 tok/s)
    Output limit found: 887

============================================================
Testing: 
============================================================
  Family: unknown
  Size: unknown
  Testing 4K... FAILED - HTTP 404

  Native context limit: 0 tokens
  Recommended input:    0 tokens

  Testing output limit...
    num_predict=1024... FAILED

============================================================
SUMMARY
============================================================

Model                       Native CTX   Max Output Output tok/s
-----------------------------------------------------------------
                                     0            0            0
hf.co/DavidAU/Qwen3-24B-A4B-Freedom-HQ-Thinking-Abliterated-Heretic-NEOMAX-Imatrix-GGUF:latest        98319            0            0
                                     0            0            0
hf.co/DevQuasar/FreedomIntelligence.HuatuoGPT-o1-8B-GGUF:Q4_K_M        98319         8192         27.2
                                     0            0            0
hf.co/alexwirrell/Meta-Llama-3-8B-Instruct-Jailbroken-Q4_K_M-GGUF:Q4_K_M         8192          874        152.3
                                     0            0            0
hf.co/mradermacher/Llama-3.1-8B-Instruct-Freedom_v3-GGUF:Q4_K_M        98319         1276         29.1
                                     0            0            0
hf.co/mradermacher/Mirai-Nova-Llama3-LocalAI-Unchained-8B-v0.2-GGUF:Q4_K_M         8192            2         16.6
                                     0            0            0
hf.co/mradermacher/Mistral-Nemo-Inst-2407-12B-Thinking-Uncensored-HERETIC-HI-Claude-Opus-i1-GGUF:Q4_K_M        98375         4096         13.0
                                     0            0            0
hf.co/mradermacher/Qwen2.5-7B-Instruct-Jailbroken-GGUF:Q4_K_M        32768         1362        161.3
                                     0            0            0
hf.co/mradermacher/Qwen3-8B-Jailbroken-i1-GGUF:Q4_K_M        40960         5119        143.3
                                     0            0            0
hf.co/mxf-pth/Qwen3-8B-Jailbroken-Q5_K_M-GGUF:Q5_K_M        40960         4024        131.5
                                     0            0            0
llama3.1:8b                      98319         1024         29.0
                                     0            0            0
llama3.2:latest                  98334         2900        269.8
                                     0            0            0
mistral:latest                   32768         1024        174.3
                                     0            0            0

Results saved to: /home/roctinam/dev/matric-memory/docs/research/smart_context_results_20260118_122149.json
